number,title,text,label,source
8476,You Can Smell Hillary’s Fear,"Daniel Greenfield, a Shillman Journalism Fellow at the Freedom Center, is a New York writer focusing on radical Islam. ",FAKE,a.com
10294,Watch The Exact Moment Paul Ryan Committed Political Suicide At A Trump Rally (VIDEO),Google Pinterest Digg Linkedin Reddit Stumbleupon Print Delicious Pocket Tumblr ,FAKE,b.com
3608,Kerry to go to Paris in gesture of sympathy,"U.S. Secretary of State John F. Kerry said Monday that he will stop in Paris later this week, amid criticism that no top American officials attended Sunday’s unity march against terrorism.

Kerry said he expects to arrive in Paris Thursday evening, as he heads home after a week abroad. He said he will fly to France at the conclusion of a series of meetings scheduled for Thursday in Sofia, Bulgaria. He plans to meet the next day with Foreign Minister Laurent Fabius and President Francois Hollande, then return to Washington.

The visit by Kerry, who has family and childhood ties to the country and speaks fluent French, could address some of the criticism that the United States snubbed France in its darkest hour in many years.

The French press on Monday was filled with questions about why neither President Obama nor Kerry attended Sunday’s march, as about 40 leaders of other nations did. Obama was said to have stayed away because his own security needs can be taxing on a country, and Kerry had prior commitments.

Among roughly 40 leaders who did attend was Israeli Prime Minister Benjamin Netanyahu, no stranger to intense security, who marched beside Hollande through the city streets. The highest ranking U.S. officials attending the march were Jane Hartley, the ambassador to France, and Victoria Nuland, the assistant secretary of state for European affairs. Attorney General Eric H. Holder Jr. was in Paris for meetings with law enforcement officials but did not participate in the march.

Kerry spent Sunday at a business summit hosted by India’s prime minister, Narendra Modi. The United States is eager for India to relax stringent laws that function as barriers to foreign investment and hopes Modi’s government will act to open the huge Indian market for more American businesses.

In a news conference, Kerry brushed aside criticism that the United States had not sent a more senior official to Paris as “quibbling a little bit.” He noted that many staffers of the American Embassy in Paris attended the march, including the ambassador. He said he had wanted to be present at the march himself but could not because of his prior commitments in India.

“But that is why I am going there on the way home, to make it crystal clear how passionately we feel about the events that have taken place there,” he said.

“And I don’t think the people of France have any doubts about America’s understanding of what happened, of our personal sense of loss and our deep commitment to the people of France in this moment of trauma.”",REAL,c.com
10142,Bernie supporters on Twitter erupt in anger against the DNC: 'We tried to warn you!',"— Kaydee King (@KaydeeKing) November 9, 2016 The lesson from tonight's Dem losses: Time for Democrats to start listening to the voters. Stop running the same establishment candidates. 
— People For Bernie (@People4Bernie) November 9, 2016 If Dems didn't want a tight race they shouldn't have worked against Bernie. 
— Walker Bragman (@WalkerBragman) November 9, 2016 
New York Times columnist Paul Krugman, who was one of Hillary Clinton’s most outspoken surrogates during the contentious Democratic primary, blamed Clinton’s poor performance on Green Party candidate Jill Stein, who has so far received a negligible number of votes nationally, saying Stein was the Ralph Nader of 2016 in preventing a Clinton victory. The account @BerniesTeachers threw Krugman’s analysis back in his face. Your candidate was the issue. Take responsibility. https://t.co/KHyOuUSrFS 
— Teachers for Bernie (@BerniesTeachers) November 9, 2016 
Ana Navarro, a Republican who recently endorsed Hillary Clinton, summed up the preposterous nature of the 2016 presidential election in this tweet: GOP nominated the only damn candidate who could lose to Hillary Clinton. Democrats nominated the only damn candidate who could lose to Trump 
— Ana Navarro (@ananavarro) November 9, 2016 
Popular left-wing Facebook page The Other 98%, which was pro-Sanders during the primary, responded to Trump’s surge by simply posting a meme of Sanders’ face with the text “All this could’ve been avoided. Thanks for nothing, DNC!” The meme has been shared almost 15,000 times in less than an hour: 
Posted by The Other 98% on Tuesday, November 8, 2016 
While Bernie Sanders endorsed Hillary Clinton just before the Democratic National Convention in July, many of his supporters remained adamant in their refusal to support the DNC-anointed candidate, pointing to WikiLeaks’ revelations that top officials at the DNC had been working behind the scenes to tip the scales in Clinton’s favor by coordinating with media figures to circulate anti-Sanders narratives. 
Rather than attribute a potential Trump presidency to the GOP nominee’s perceived popularity among voters, the closeness of this election could be credited to Hillary Clinton’s unfavorable ratings. According to RealClearPolitics, anywhere between 51 and 57 percent of voters had a negative opinion of the Democratic nominee. 
As of 11 PM Eastern, Florida, Michigan, Pennsylvania, and Wisconsin remain too close to call. Clinton has 197 electoral votes to Trump’s 187. 

Zach Cartwright is an activist and author from Richmond, Virginia. He enjoys writing about politics, government, and the media. Send him an email at [email protected]",FAKE,d.com
875,The Battle of New York: Why This Primary Matters,"It's primary day in New York and front-runners Hillary Clinton and Donald Trump are leading in the polls.

Trump is now vowing to win enough delegates to clinch the Republican nomination and prevent a contested convention. But Sens.Ted Cruz, R-Texas, Bernie Sanders, D-Vt., and Ohio Gov. John Kasich and aren't giving up just yet.

A big win in New York could tip the scales for both the Republican and Democratic front-runners in this year's race for the White House. Clinton and Trump have each suffered losses in recent contests, shifting the momentum to their rivals.

""We have won eight out of the last nine caucuses and primaries! Cheer!"" Sanders recently told supporters.

While wins in New York for Trump and Clinton are expected, the margins of those victories are also important.

Trump needs to capture more than 50 percent of the vote statewide if he wants to be positioned to win all of the state's 95 GOP delegates. That would put him one step closer to avoiding a contested convention.

""We've got to vote and you know Cruz is way, way down in the polls,"" Trump urged supporters.

Meanwhile, Sanders is hoping for a close race in the Empire State. A loss by 10 points means he'll need to win 80 percent of the remaining delegates to clinch the nomination.

Despite a predicted loss in New York, Cruz hasn't lost momentum. He's hoping to sweep up more delegates this weekend while he's talking about how he can win in November.

""Because if I'm the nominee, we win the General Election,"" Cruz promised his supporters. ""We're beating Hillary in the key swing states, we're beating Hillary with Independents, we're beating Hillary with young people.""

For now, Cruz, Kasich, and Sanders have all moved on from New York to other states. Trump and Clinton are the only two staying in their home state to watch the results come in.",REAL,e.com
6903,"Tehran, USA","I’m not an immigrant, but my grandparents are. More than 50 years ago, they arrived in New York City from Iran. I grew up mainly in central New Jersey, an American kid playing little league for the Raritan Red Sox and soccer for the Raritan Rovers. In 1985, I travelled with my family to our ancestral land. I was only eight, but old enough to understand that the Iranians had lost their liberty and freedom. I saw the abject despair of a people who, in a desperate attempt to bring about change, had ushered in nationalist tyrants led by Ayatollah Khomeini. 
What I witnessed during that year in Iran changed the course of my life. In 1996, at age 19, wanting to help preserve the blessings of liberty and freedom we enjoy in America, I enlisted in the U.S. Navy. Now, with the rise of Donald Trump and his nationalist alt-right movement, I’ve come to feel that the values I sought to protect are in jeopardy. 
In Iran, theocratic fundmentalists sowed division and hatred of outsiders — of Westerners, Christians, and other religious minorities. Here in America, the right wing seems to have stolen passages directly from their playbook as it spreads hatred of immigrants, particularly Muslim ones. This form of nationalistic bigotry — Islamophobia — threatens the heart of our nation. When I chose to serve in the military, I did so to protect what I viewed as our sacred foundational values of liberty, equality, and democracy. Now, 20 years later, I’ve joined forces with fellow veterans to again fight for those sacred values, this time right here at home. 
“Death to America!” 
As a child, I sat in my class at the international school one sunny morning and heard in the distance the faint sounds of gunfire and rising chants of “Death to America!” That day would define the rest of my life. 
It was Tehran, the capital of Iran, in 1985. I was attending a unique school for bilingual students who had been born in Western nations. It had become the last refuge in that city with any tolerance for Western teaching, but that also made it a target for military fundamentalists. As the gunfire drew closer, I heard boots pounding the marble tiles outside, marching into our building, and thundering down the corridor toward my classroom. As I heard voices chanting “Death to America!” I remember wondering if I would survive to see my parents again. 
In a flash of green and black uniforms, those soldiers rushed into our classroom, grabbed us by our shirt collars, and yelled at us to get outside. We were then packed into the school’s courtyard where a soldier pointed his rifle at our group and commanded us to look up. Almost in unison, my classmates and I raised our eyes and saw the flags of our many nations being torn down and dangled from the balcony, then set ablaze and tossed, still burning, into the courtyard. As those flags floated to the ground in flames, the soldiers fired their guns in the air. Shouting, they ordered us — if we ever wanted to see our families again — to swear allegiance to the Grand Ayatollah Khomeini and trample on the remains of the burning symbols of our home countries. I scanned the smoke that was filling the courtyard for my friends and classmates and, horrified, watched them capitulate and begin to chant, “Death to America!” as they stomped on our sacred symbols. 
I was so angry that, young as I was, I began to plead with them to come to their senses. No one paid the slightest attention to an eight year old and yet, for the first time in my life, I felt something like righteous indignation. I suspect that, born and raised in America, I was already imbued with such a sense of privilege that I just couldn’t fathom the immense danger I was in. Certainly, I was acting in ways no native Iranian would have found reasonable. 
Across the smoke-filled courtyard, I saw a soldier coming at me and knew he meant to force me to submit. I spotted an American flag still burning, dropped to my knees, and grabbed the charred pieces from underneath a classmate’s feet. As the soldier closed in on me, I ducked and ran, still clutching my charred pieces of flag into a crowd of civilians who had gathered to witness the commotion. The events of that day would come to define all that I have ever stood for — or against. 
“Camel Jockey,” “Ayatollah,” and “Gandhi” 
My parents and I soon returned to the United States and I entered third grade. More than anything, I just wanted to be normal, to fit in and be accepted by my peers. Unfortunately, my first name, Nader (which I changed to Nate upon joining the Navy), and my swarthy Middle Eastern appearance, were little help on that score, eliciting regular jibes from my classmates. Even at that young age, they had already mastered a veritable thesaurus of ethnic defamation, including “camel jockey,” “sand-nigger,” “raghead,” “ayatollah,” and ironically, “Gandhi” (which I now take as a compliment). My classmates regularly sought to “other-ize” me in those years, as if I were a lesser American because of my faith and ethnicity. 
Yet I remember that tingling in my chest when I first donned my Cub Scout uniform — all because of the American flag patch on its shoulder. Something felt so good about wearing it, a feeling I still had when I joined the military. It seems that the flag I tried to rescue in Tehran was stapled to my heart, or that’s how I felt anyway as I wore my country’s uniform. 
When I took my oath of enlistment in the U.S. Navy, I gave my mom a camera and asked her to take some photos, but she was so overwhelmed with pride and joy that she cried throughout the ceremony and managed to snap only a few images of the carpet. She cried even harder when I was selected to serve as the first Muslim-American member of the U.S. Navy Presidential Ceremonial Honor Guard . On that day, I was proud, too, and all the taunts of those bullies of my childhood seemed finally silenced. 
Being tormented because of my ethnicity and religion in those early years had another effect on me. It caused me to become unusually sensitive to the nature of other people. Somehow, I grasped that, if it weren’t for a fear of the unknown, there was an inherent goodness and frail humanity lurking in many of the kids who bullied and harassed me. Often, I discovered, those same bullies could be tremendously kind to their families, friends, or even strangers. I realized, then, that if, despite everything, I could lay myself bare and trust them enough to reach out in kindness, I might in turn gain their trust and they might then see me, too, and stop operating from such a place of fear and hate. 
Through patience, humor, and understanding, I was able to offer myself as the embodiment of my people and somehow defang the “otherness” of so much that Americans found scary. To this day, I have friends from elementary school, middle school, high school, and the military who tell me that I am the only Muslim they have ever known and that, had they not met me, their perspective on Islam would have been wholly subject to the prevailing fear-based narrative that has poisoned this country since September 11, 2001. 
In 1998, I became special assistant to the Master Chief Petty Officer of the Navy and then, in 1999, I was recruited to serve at the Defense Intelligence Agency. In August 2000, I transferred to the Naval Reserve. 
In the wake of 9/11, I began to observe how so many of my fellow Americans were adopting a fundamentalist “us vs. them” attitude towards Muslims and Islam. I suddenly found myself in an America where the scattered insults I had endured as a child took on an overarching and sinister meaning and form, where they became something like an ideology and way of life. 
By the time I completed my military service in 2006, I had begun to understand that our policies in the Middle East,similarly disturbed, seemed in pursuit of little more than perpetual warfare. That, in turn, was made possible by the creation of a new enemy: Islam — or rather of a portrait, painted by the powers-that-be, of Islam as a terror religion, as a hooded villain lurking out there somewhere in the desert, waiting to destroy us. I knew that attempting to dispel, through the patient approach of my childhood, the kind of Islamophobia that now had the country by the throat was not going to be enough. Post-9/11 attacks on Muslims in the U.S. and elsewhere were not merely childish taunts. 
For the first time in my life, in a country gripped by fear, I believed I was witnessing a shift, en masse, toward an American fundamentalism and ultra-nationalism that reflected a wanton lack of reason, not to mention fact. As a boy in Iran, I had witnessed the dark destination down which such a path could take a country. Now, it seemed to me, in America’s quest to escape the very demons we had sown by our own misadventures in the Middle East, and forsaking the hallmarks of our founding, we risked becoming everything we sought to defeat. 
The Boy in the Schoolyard Grown Up 
On February 10, 2015, three young American students, Yusor Abu-Salha, Razan Abu-Salha, and Deah Shaddy Barakat, were executed at an apartment complex in Chapel Hill, North Carolina. The killer was a gun-crazy white man filled with hate and described by his own daughter as “a monster.” Those assassinations struck a special chord of sorrow and loss in me. My mom and I cried and prayed together for those students and their families. 
The incident in Chapel Hill also awoke in me some version of the righteous indignation I had felt so many years earlier in that smoke-filled courtyard in Iran. I would be damned if I stood by while kids in my country were murdered simply because of their faith. It violated every word of the oath I had taken when I joined the military and desecrated every value I held in my heart as a sacred tenet of our nation. White nationalists and bigots had, by then, thrown down the gauntlet for so much of this, using Islamophobia to trigger targeted assassinations in the United States. This was terrorism, pure and simple, inspired by hate-speakers here at home. 
At that moment, I reached out to fellow veterans who, I thought, might be willing to help — and it’s true what they say about soul mates being irrevocably drawn to each other. When I contacted Veterans For Peace , an organization dedicated to exposing the costs of war and militarism, I found the leadership well aware of the inherent dangers of Islamophobia and of the need to confront this new enemy. So Executive Director Michael McPhearson formed a committee of vets from around the country to decide how those of us who had donned uniforms to defend this land could best battle the phenomenon — and I, of course, joined it. 
From that committee emerged Veterans Challenge Islamophobia (VCI). It now has organizers in Arizona, Georgia, New Jersey, and Texas, and that’s just a beginning. Totally nonpartisan, VCI focuses on politicians of any party who engage in hate speech. We’ve met with leaders of American Muslim communities, sat with them through Ramadan, and attended their Iftar dinners to break our fasts together. In the wake of the Orlando shooting , we at VCI also mobilized to fight back against attempts to pit the Muslim community against the LGBTQ+ community. 
Our group was born of the belief that, as American military veterans, we had a responsibility to call out bigotry, hatred, and the perpetuation of endless warfare. We want the American Muslim community to know that they have allies, and that those allies are indeed veterans as well. We stand with them and for them and, for those of us who are Muslim, among them. 
Nationalism and xenophobia have no place in American life, and I, for my part, don’t think Donald Trump or anyone like him should be able to peddle Islamophobia in an attempt to undermine our national unity. Without Islamophobia, there no longer exists a “clash of civilizations.” Without Islamophobia, whatever the problems in the world may be, there is no longer an “us vs. them” and it’s possible to begin reimagining a world of something other than perpetual war. 
As of now, this remains the struggle of my life, for despite my intense love for America, some of my countrymen increasingly see American Muslims as the “other,” the enemy. 
My Mom taught me as a boy that the only thing that mattered was what was in my heart. Now, with her in mind and as a representative of VCI, when I meet fellow Americans I always remember my childhood experiences with my bullying peers. And I still lay myself bare, as I did then. I give trust to gain trust, but always knowing that these days this isn’t just a matter of niceties. It’s a question of life or death. It’s part of a battle for the soul of our nation. 
In many ways, I still consider myself that boy in the school courtyard in Tehran trying to rescue charred pieces of that flag from those trampling feet. It’s just that now I’m doing it in my own country. 
Nate Terani is a veteran of the U.S. Navy and served in military intelligence with the Defense Intelligence Agency. He is currently a member of the leadership team at Common Defense PAC and regional campaign organizer with Veterans Challenge Islamophobia . He is a featured columnist with the Arizona Muslim Voice newspaper. (Reprinted from TomDispatch by permission of author or representative)",FAKE,f.com
7341,Girl Horrified At What She Watches Boyfriend Do After He Left FaceTime On,"Share This Baylee Luciani (left), Screenshot of what Baylee caught on FaceTime (right) 
The closest Baylee Luciani could get to her boyfriend, who’s attending college in Austin, was through video online chat. The couple had regular “dates” this way to bridge the 200-mile distance between them. However, the endearing arrangement quickly came to an end after his FaceTime was left on and caught something that left his girlfriend horrified. 
Baylee had been discussing regular things with her boyfriend, Yale Gerstein, who was on the other side of the screen on an otherwise average evening. This video chat was not unlike all the others she had with Yale from his apartment near Austin Community College until the 19-year-old girlfriend heard some scratching sounds after FaceTime had been left on. 
According to KRON , Baylee was mid-conversation with Yale when scratches at the door caught both of their attention and he got up from his bed, where the computer was, to see who was at his door. He barely turned the handle to open in when masked men entered the room and beat Yale’s face in and slammed him down on his bed while shoving a pistol in his cheek. The intruders didn’t seem to know or care that FaceTime was still on and Baylee’s face, seen in the corner, was watching everything, terrified that she was about to see her boyfriend murdered in front of her, as she watched him fight for his life. 
Admitting that she first thought it was a joke, seconds later, she came to the horrid realization that he was being robbed and called her dad, who was at home with her in Dallas, into the room. “I was scared, because they were saying I’m going to blow your head off, I’m going to kill you,” Baylee explained along with the chilling feeling she got when the intruder finally realized the video chat was running and looked right at her in the camera. “I’m like wow… seriously watching an armed robbery happen to somebody that I care about,” she added. Screengrabs of intruder forcing Yale down on his bed while Baylee and her father watch on FaceTime in horror 
With a clear view of at least one intruder’s face, Baylee began taking screenshots of the suspect in the act as she and her dad called the police to report what was going on. She got the pictures right in time since, seconds later, the intruder decided to disconnect the computer as he and the suspects took off with thousands of dollars worth of Yale’s music equipment. Although the boyfriend’s life was spared in the traumatizing ordeal for the two of them, he said that the thieves took something from him that can’t be replaced. 
“I had just finished my first album as a solo artist,” Yale said. “That’s all lost,” since they took the recordings on the equipment, which means nothing to the thieves and everything to the victim. It’s not often that you hear of FaceTime solving crimes or potentially saving lives, which is what happened in this case. Although it was difficult to watch, Baylee, being there through technology, was an instrumental part in protecting Yale, who hopefully learned that he better take advantage of Texas’ great gun laws and arm himself with more than just a computer.",FAKE,g.com
95,‘Britain’s Schindler’ Dies at 106,"A Czech stockbroker who saved more than 650 Jewish children from Nazi Germany has died at the age of 106. Dubbed “Britain’s Schindler,” Nicholas Winton arranged to transport Jewish youngsters from Prague after Germany annexed Czechoslovakia in March 1939. Though the children were originally set to arrive in Britain by plane, the German invasion forced Winton to transport them by train through Germany before they eventually reached England by boat. Winton arranged eight trains, known as the Kindertransports (children’s transports), to evacuate the children, and died on the anniversary of the 1939 departure of the one carrying the largest number of children: 241. Winton was knighted by Queen Elizabeth II in 2003 for his efforts, despite keeping it secret for nearly 50 years.",REAL,h.com
4869,Fact check: Trump and Clinton at the 'commander-in-chief' forum,"Hillary Clinton and Donald Trump made some inaccurate claims during an NBC “commander-in-chief” forum on military and veterans issues:


These and other examples were dug up by our friend Glenn Kessler, the Washington Post‘s “Fact Checker,” who researched a Trump claim in April that Cuba’s and Saudi Arabia’s handling of Obama’s visits were “without precedent.” Kessler said of Trump, “once again he’s wrong, wrong, wrong.”
",REAL,i.com
